{"version":1,"timezone":"Asia/Seoul","sampleTime":"08:00","source":"astronomy-engine 2.1.19","from":"2026-10-01","to":"2026-12-31","days":[{"date":"2026-10-01","moon":"gemini","transit":"enter","phase":"waning-gibbous","illumination":78},{"date":"2026-10-02","moon":"gemini","transit":"leave","phase":"last-quarter","illumination":68},{"date":"2026-10-03","moon":"cancer","transit":"enter","phase":"last-quarter","illumination":57},{"date":"2026-10-04","moon":"cancer","transit":"leave","phase":"last-quarter","illumination":46},{"date":"2026-10-05","moon":"leo","transit":"enter","phase":"last-quarter","illumination":34},{"date":"2026-10-06","moon":"leo","transit":"stay","phase":"waning-crescent","illumination":24},{"date":"2026-10-07","moon":"leo","transit":"leave","phase":"waning-crescent","illumination":15,"nextSign":"virgo","changeAt":"11:52"},{"date":"2026-10-08","moon":"virgo","transit":"enter","phase":"waning-crescent","illumination":8},{"date":"2026-10-09","moon":"virgo","transit":"leave","phase":"new","illumination":3,"nextSign":"libra","changeAt":"17:10"},{"date":"2026-10-10","moon":"libra","transit":"enter","phase":"new","illumination":1},{"date":"2026-10-11","moon":"libra","transit":"leave","phase":"new","illumination":0},{"date":"2026-10-12","moon":"scorpio","transit":"enter","phase":"new","illumination":2},{"date":"2026-10-13","moon":"scorpio","transit":"stay","phase":"waxing-crescent","illumination":6},{"date":"2026-10-14","moon":"scorpio","transit":"leave","phase":"waxing-crescent","illumination":11,"nextSign":"sagittarius","changeAt":"09:59"},{"date":"2026-10-15","moon":"sagittarius","transit":"enter","phase":"waxing-crescent","illumination":18},{"date":"2026-10-16","moon":"sagittarius","transit":"leave","phase":"waxing-crescent","illumination":26,"nextSign":"capricorn","changeAt":"21:57"},{"date":"2026-10-17","moon":"capricorn","transit":"enter","phase":"first-quarter","illumination":34},{"date":"2026-10-18","moon":"capricorn","transit":"stay","phase":"first-quarter","illumination":43},{"date":"2026-10-19","moon":"capricorn","transit":"leave","phase":"first-quarter","illumination":53,"nextSign":"aquarius","changeAt":"10:39"},{"date":"2026-10-20","moon":"aquarius","transit":"enter","phase":"first-quarter","illumination":62},{"date":"2026-10-21","moon":"aquarius","transit":"leave","phase":"waxing-gibbous","illumination":72,"nextSign":"pisces","changeAt":"21:35"},{"date":"2026-10-22","moon":"pisces","transit":"enter","phase":"waxing-gibbous","illumination":80},{"date":"2026-10-23","moon":"pisces","transit":"leave","phase":"waxing-gibbous","illumination":88},{"date":"2026-10-24","moon":"aries","transit":"enter","phase":"waxing-gibbous","illumination":94},{"date":"2026-10-25","moon":"aries","transit":"stay","phase":"full","illumination":98},{"date":"2026-10-26","moon":"aries","transit":"leave","phase":"full","illumination":100,"nextSign":"taurus","changeAt":"08:34"},{"date":"2026-10-27","moon":"taurus","transit":"enter","phase":"full","illumination":99},{"date":"2026-10-28","moon":"taurus","transit":"leave","phase":"waning-gibbous","illumination":95,"nextSign":"gemini","changeAt":"10:01"},{"date":"2026-10-29","moon":"gemini","transit":"enter","phase":"waning-gibbous","illumination":89},{"date":"2026-10-30","moon":"gemini","transit":"leave","phase":"waning-gibbous","illumination":81,"nextSign":"cancer","changeAt":"11:05"},{"date":"2026-10-31","moon":"cancer","transit":"enter","phase":"waning-gibbous","illumination":71},{"date":"2026-11-01","moon":"cancer","transit":"leave","phase":"last-quarter","illumination":60,"nextSign":"leo","changeAt":"13:18"},{"date":"2026-11-02","moon":"leo","transit":"enter","phase":"last-quarter","illumination":49},{"date":"2026-11-03","moon":"leo","transit":"leave","phase":"last-quarter","illumination":38,"nextSign":"virgo","changeAt":"17:27"},{"date":"2026-11-04","moon":"virgo","transit":"enter","phase":"waning-crescent","illumination":28},{"date":"2026-11-05","moon":"virgo","transit":"leave","phase":"waning-crescent","illumination":19,"nextSign":"libra","changeAt":"23:38"},{"date":"2026-11-06","moon":"libra","transit":"enter","phase":"waning-crescent","illumination":11},{"date":"2026-11-07","moon":"libra","transit":"leave","phase":"waning-crescent","illumination":6},{"date":"2026-11-08","moon":"scorpio","transit":"enter","phase":"new","illumination":2},{"date":"2026-11-09","moon":"scorpio","transit":"stay","phase":"new","illumination":0},{"date":"2026-11-10","moon":"scorpio","transit":"leave","phase":"new","illumination":1,"nextSign":"sagittarius","changeAt":"17:36"},{"date":"2026-11-11","moon":"sagittarius","transit":"enter","phase":"new","illumination":3},{"date":"2026-11-12","moon":"sagittarius","transit":"leave","phase":"waxing-crescent","illumination":7},{"date":"2026-11-13","moon":"capricorn","transit":"enter","phase":"waxing-crescent","illumination":12},{"date":"2026-11-14","moon":"capricorn","transit":"stay","phase":"waxing-crescent","illumination":19},{"date":"2026-11-15","moon":"capricorn","transit":"leave","phase":"waxing-crescent","illumination":27,"nextSign":"aquarius","changeAt":"18:24"},{"date":"2026-11-16","moon":"aquarius","transit":"enter","phase":"first-quarter","illumination":36},{"date":"2026-11-17","moon":"aquarius","transit":"leave","phase":"first-quarter","illumination":45},{"date":"2026-11-18","moon":"pisces","transit":"enter","phase":"first-quarter","illumination":55},{"date":"2026-11-19","moon":"pisces","transit":"stay","phase":"first-quarter","illumination":65},{"date":"2026-11-20","moon":"pisces","transit":"leave","phase":"waxing-gibbous","illumination":74,"nextSign":"aries","changeAt":"14:52"},{"date":"2026-11-21","moon":"aries","transit":"enter","phase":"waxing-gibbous","illumination":83},{"date":"2026-11-22","moon":"aries","transit":"leave","phase":"waxing-gibbous","illumination":90,"nextSign":"taurus","changeAt":"19:09"},{"date":"2026-11-23","moon":"taurus","transit":"enter","phase":"waxing-gibbous","illumination":96},{"date":"2026-11-24","moon":"taurus","transit":"leave","phase":"full","illumination":99,"nextSign":"gemini","changeAt":"20:09"},{"date":"2026-11-25","moon":"gemini","transit":"enter","phase":"full","illumination":100},{"date":"2026-11-26","moon":"gemini","transit":"leave","phase":"full","illumination":97,"nextSign":"cancer","changeAt":"19:51"},{"date":"2026-11-27","moon":"cancer","transit":"enter","phase":"waning-gibbous","illumination":92},{"date":"2026-11-28","moon":"cancer","transit":"leave","phase":"waning-gibbous","illumination":84,"nextSign":"leo","changeAt":"20:20"},{"date":"2026-11-29","moon":"leo","transit":"enter","phase":"waning-gibbous","illumination":75},{"date":"2026-11-30","moon":"leo","transit":"leave","phase":"last-quarter","illumination":64,"nextSign":"virgo","changeAt":"23:12"},{"date":"2026-12-01","moon":"virgo","transit":"enter","phase":"last-quarter","illumination":53},{"date":"2026-12-02","moon":"virgo","transit":"leave","phase":"last-quarter","illumination":43},{"date":"2026-12-03","moon":"libra","transit":"enter","phase":"last-quarter","illumination":32},{"date":"2026-12-04","moon":"libra","transit":"stay","phase":"waning-crescent","illumination":23},{"date":"2026-12-05","moon":"libra","transit":"leave","phase":"waning-crescent","illumination":15,"nextSign":"scorpio","changeAt":"13:35"},{"date":"2026-12-06","moon":"scorpio","transit":"enter","phase":"waning-crescent","illumination":9},{"date":"2026-12-07","moon":"scorpio","transit":"leave","phase":"waning-crescent","illumination":4},{"date":"2026-12-08","moon":"sagittarius","transit":"enter","phase":"new","illumination":1},{"date":"2026-12-09","moon":"sagittarius","transit":"stay","phase":"new","illumination":0},{"date":"2026-12-10","moon":"sagittarius","transit":"leave","phase":"new","illumination":1,"nextSign":"capricorn","changeAt":"12:08"},{"date":"2026-12-11","moon":"capricorn","transit":"enter","phase":"new","illumination":3},{"date":"2026-12-12","moon":"capricorn","transit":"leave","phase":"waxing-crescent","illumination":8},{"date":"2026-12-13","moon":"aquarius","transit":"enter","phase":"waxing-crescent","illumination":13},{"date":"2026-12-14","moon":"aquarius","transit":"stay","phase":"waxing-crescent","illumination":20},{"date":"2026-12-15","moon":"aquarius","transit":"leave","phase":"waxing-crescent","illumination":28,"nextSign":"pisces","changeAt":"13:35"},{"date":"2026-12-16","moon":"pisces","transit":"enter","phase":"first-quarter","illumination":37},{"date":"2026-12-17","moon":"pisces","transit":"leave","phase":"first-quarter","illumination":47,"nextSign":"aries","changeAt":"23:34"},{"date":"2026-12-18","moon":"aries","transit":"enter","phase":"first-quarter","illumination":58},{"date":"2026-12-19","moon":"aries","transit":"leave","phase":"first-quarter","illumination":68},{"date":"2026-12-20","moon":"taurus","transit":"enter","phase":"waxing-gibbous","illumination":78},{"date":"2026-12-21","moon":"taurus","transit":"leave","phase":"waxing-gibbous","illumination":86},{"date":"2026-12-22","moon":"gemini","transit":"enter","phase":"waxing-gibbous","illumination":93},{"date":"2026-12-23","moon":"gemini","transit":"leave","phase":"full","illumination":98},{"date":"2026-12-24","moon":"cancer","transit":"enter","phase":"full","illumination":100},{"date":"2026-12-25","moon":"cancer","transit":"leave","phase":"full","illumination":99},{"date":"2026-12-26","moon":"leo","transit":"enter","phase":"waning-gibbous","illumination":95},{"date":"2026-12-27","moon":"leo","transit":"leave","phase":"waning-gibbous","illumination":88},{"date":"2026-12-28","moon":"virgo","transit":"enter","phase":"waning-gibbous","illumination":79},{"date":"2026-12-29","moon":"virgo","transit":"stay","phase":"waning-gibbous","illumination":69},{"date":"2026-12-30","moon":"virgo","transit":"leave","phase":"last-quarter","illumination":59,"nextSign":"libra","changeAt":"11:26"},{"date":"2026-12-31","moon":"libra","transit":"enter","phase":"last-quarter","illumination":48}]}
